{
  "schema_version": 1,
  "implementation_version": "0.2.0",
  "stage": "shot_local_face_tracker",
  "status": "completed",
  "dry_run": false,
  "job_id": "shot_tracker_result_fixture_001",
  "work_order_sha256": "1111111111111111111111111111111111111111111111111111111111111111",
  "result_key": "2222222222222222222222222222222222222222222222222222222222222222",
  "result_path": "/srv/himr/private/results/vision/shot-local-face-tracks/2222222222222222222222222222222222222222222222222222222222222222/result.json",
  "implementation": {
    "path": "/srv/himr/pipeline/shot_local_face_tracker.py",
    "sha256": "3333333333333333333333333333333333333333333333333333333333333333",
    "byte_count": 50000,
    "implementation_version": "0.2.0"
  },
  "policy": {
    "visibility": "private",
    "network_allowed": false,
    "embeddings_allowed": false,
    "cross_shot_join_allowed": false,
    "identity_decision_allowed": false,
    "active_speaker_decision_allowed": false,
    "publication_authority": "none",
    "human_review_required": true
  },
  "runtime": {
    "python": {
      "path": "/usr/bin/python3.12",
      "storage_uri": "file:///usr/bin/python3.12",
      "sha256": "4444444444444444444444444444444444444444444444444444444444444444",
      "byte_count": 12000,
      "visibility": "host_runtime",
      "expected_version": "3.12.11"
    },
    "observation": {
      "python_version": "3.12.11",
      "cpu_threads": 1,
      "network_used": false
    }
  },
  "input": {
    "detections": {
      "path": "/srv/himr/private/detections/fixture.json",
      "storage_uri": "file:///srv/himr/private/detections/fixture.json",
      "sha256": "5555555555555555555555555555555555555555555555555555555555555555",
      "byte_count": 4096,
      "visibility": "private"
    },
    "recording_id": "recording_fixture_shot_tracker_001",
    "detector": {
      "name": "fixture_detector",
      "version": "fixture-only",
      "recipe_id": "fixture_detector_recipe_v1"
    },
    "coordinate_system": "pixel_xywh_top_left"
  },
  "recipe": {
    "recipe_id": "shot_local_face_tracker_dev_fixture_v1",
    "algorithm": "constant_velocity_hungarian_iou_v1",
    "prediction": "last_two_matched_boxes_per_frame_delta_v1",
    "assignment_objective": "max_cardinality_then_max_total_iou_stable_v1",
    "minimum_assignment_iou": 0.3,
    "max_gap_frames": 1,
    "minimum_confirmed_detections": 1,
    "iou_round_decimals": 8
  },
  "shots": [
    {
      "shot_id": "shot_000",
      "shot_ordinal": 0,
      "start_frame_index": 0,
      "end_frame_index_exclusive": 1,
      "start_timestamp_ms": 0,
      "end_timestamp_ms_exclusive": 40
    }
  ],
  "frames": [
    {
      "frame_id": "frame_000",
      "shot_id": "shot_000",
      "frame_index": 0,
      "timestamp_ms": 0,
      "detection_count": 1,
      "assignments": [],
      "gaps": [],
      "starts": [
        {
          "track_id": "face_track_fixture_000",
          "detection_id": "detection_000"
        }
      ],
      "closed_track_ids": ["face_track_fixture_000"]
    }
  ],
  "tracks": [
    {
      "track_id": "face_track_fixture_000",
      "track_ordinal": 0,
      "shot_id": "shot_000",
      "created_frame_index": 0,
      "created_timestamp_ms": 0,
      "last_detection_frame_index": 0,
      "last_detection_timestamp_ms": 0,
      "ended_frame_index": 0,
      "ended_timestamp_ms": 0,
      "end_reason": "shot_end",
      "detection_count": 1,
      "total_gap_count": 0,
      "max_consecutive_gap_count": 0,
      "confirmed_at_frame_index": 0,
      "confirmed_at_detection_id": "detection_000",
      "observations": [
        {
          "event": "track_started",
          "frame_id": "frame_000",
          "frame_index": 0,
          "timestamp_ms": 0,
          "detection_id": "detection_000",
          "observed_box": {
            "x": 100,
            "y": 80,
            "width": 80,
            "height": 100
          },
          "predicted_box": null,
          "assignment_iou": null,
          "consecutive_gap_count": 0
        }
      ],
      "identity_state": "unknown",
      "identity_label": null,
      "identity_probability": null,
      "active_speaker_state": "unknown",
      "active_speaker_score": null,
      "publication": false,
      "confirmation_state": "confirmed"
    }
  ],
  "authority": {
    "identity_state": "unknown",
    "identity_label": null,
    "identity_probability": null,
    "identity_decision": false,
    "active_speaker_state": "unknown",
    "active_speaker_score": null,
    "active_speaker_decision": false,
    "cross_shot_join": false,
    "publication": false,
    "human_review_required": true
  }
}
